{
  "$schema": "https://json-schema.org/draft/2020-12/schema",
  "$id": "https://memorybridge.dev/schemas/AgentIdentity.v0.1.json",
  "title": "AgentIdentity",
  "description": "Identity and trust contract for an agent participating in a Memory Bridge. Defines who an agent is, what it is authoritative over, and how much its writes and votes are weighted. additionalProperties is intentionally true to preserve forward compatibility with extended agent records.",
  "type": "object",
  "additionalProperties": true,
  "required": [
    "id",
    "name",
    "trust_class",
    "domain_authorities",
    "confidence_ceiling",
    "quorum_weight",
    "created_at",
    "registered_by"
  ],
  "properties": {
    "id": {
      "type": "string",
      "description": "Stable, unique identifier for the agent within a project. Lowercase, hyphen-separated by convention.",
      "examples": ["claude", "gemini-cli", "alex-pi-agent"]
    },
    "name": {
      "type": "string",
      "description": "Human-readable display name for the agent.",
      "examples": ["Claude (Anthropic)", "Gemini CLI Worker"]
    },
    "trust_class": {
      "type": "string",
      "description": "Precedence and confidence tier of the agent. Determines the confidence ceiling enforced on this agent's writes and its precedence when beliefs conflict. Precedence order: user > system > model agents.",
      "enum": ["user", "system", "claude", "model", "worker"]
    },
    "domain_authorities": {
      "type": "array",
      "description": "Domains in which this agent's beliefs are treated as authoritative. Used to rank relevance during retrieval and to resolve conflicts in favor of the domain owner.",
      "items": { "type": "string" },
      "examples": [["strategy", "architecture", "writing"]]
    },
    "confidence_ceiling": {
      "type": "number",
      "description": "Maximum confidence this agent may assert on any single belief, regardless of the confidence value it submits. Writes above the ceiling are clamped. Convention: user/system = 1.0, model agents capped below 1.0 to prevent runaway self-reinforcement.",
      "minimum": 0,
      "maximum": 1
    },
    "quorum_weight": {
      "type": "number",
      "description": "Voting weight of this agent in Parliament governance decisions. A proposal passes when the sum of YES weights meets the configured quorum threshold.",
      "minimum": 0
    },
    "created_at": {
      "type": "string",
      "format": "date-time",
      "description": "ISO 8601 timestamp of when this identity was registered."
    },
    "registered_by": {
      "type": "string",
      "description": "Identifier of the principal (typically a human operator) who registered this agent.",
      "examples": ["alex"]
    },
    "registered_skills": {
      "type": "array",
      "description": "Optional. Named skills or operations this agent is registered to perform.",
      "items": { "type": "string" }
    },
    "notes": {
      "type": "string",
      "description": "Optional. Free-text operator notes about the agent's role or constraints."
    }
  }
}
